{
  "version": "v0.1",
  "id": "claude-sonnet",
  "name": "Claude Sonnet",
  "provider": "anthropic",
  "default_prompt_pack_id": "claude-sonnet-system",
  "recommended_for": [
    "Medium-tier policy writing and contracts review",
    "Explaining governance tradeoffs with trace linkage"
  ],
  "known_failure_modes": [
    "May over-abstract unless forced to be implementation-specific",
    "May suggest runtime implementation inside governance-core unless constrained"
  ],
  "tooling_assumptions": [
    "This repository is governance-core only; do not implement product runtime or real MCP servers here.",
    "Keep deterministic validation as the merge gate for any change."
  ]
}

