{
  "version": "v0.1",
  "id": "gemini-pro",
  "name": "Gemini Pro",
  "provider": "google",
  "default_prompt_pack_id": "gemini-pro-system",
  "recommended_for": [
    "Medium-tier policy/document drafting with fixed contracts",
    "Summarization and structured briefs (non-verdict-critical content only)"
  ],
  "known_failure_modes": [
    "Occasional format drift in strict JSON outputs",
    "Overconfident claims without evidence refs"
  ],
  "tooling_assumptions": [
    "This repository is governance-core only; do not implement product runtime or real MCP servers here.",
    "Outputs must remain recommendation-only unless validated via deterministic gates."
  ]
}

