{
  "version": "v0.1",
  "id": "codex-mini",
  "name": "Codex Mini",
  "provider": "openai",
  "default_prompt_pack_id": "codex-mini-system",
  "recommended_for": [
    "Low-tier routing: small edits, short validations",
    "Drafting small deterministic artifacts under strict constraints"
  ],
  "known_failure_modes": [
    "Shallow reasoning on cross-file invariants",
    "Under-specifying edge cases"
  ],
  "tooling_assumptions": [
    "This repository is governance-core only; do not implement product runtime or real MCP servers here.",
    "Verdict-critical paths must not depend on wall-clock time, randomness, or network access."
  ]
}

