{
  "version": "v0.1",
  "id": "claude-opus",
  "name": "Claude Opus",
  "provider": "anthropic",
  "default_prompt_pack_id": "claude-opus-system",
  "recommended_for": [
    "High-tier policy design and boundary review preparation",
    "Complex governance reasoning under explicit human gate"
  ],
  "known_failure_modes": [
    "May generate verbose plans; must stay within deterministic constraints",
    "Risk of scope expansion; must stop and request human gate"
  ],
  "tooling_assumptions": [
    "This repository is governance-core only; do not implement product runtime or real MCP servers here.",
    "High-tier changes require explicit human approval and trace linkage."
  ]
}

